,id,text,media_url,video_url,created_at,retweet_count,favorite_count,source,user_id,user_screen_name,user_name,user_created_at,user_description,user_followers_count,user_friends_count,user_location,user_coordinates
222,821576635728195584,RT @JRubinBlogger: Trump has bared his fangs to Merkel. He will do untold damage to Europe | Josef Joffe https://t.co/6sSnp2tmBu,,,2017-01-18 04:35:08,57,0,Twitter for iPhone,2609200999,MyEye2Yours,MyEye2Yours,2014-07-07 08:11:11,,103,35,Here and Now,
223,821576631378726912,Imagine all the damage Julius Randle would do if he had a better jump shot.,,,2017-01-18 04:35:07,0,0,Twitter for Android,78259214,kaperzack,Zack.,2009-09-29 08:59:51,"?? | Degreed Chemical Engineer | NBA ? and F1 ? enthusiast, also a big fan of Arsenal FC |",887,442,Capitale du cuivre (+243),
224,821576620767113216,Today I did a legitimate leg day for the first time since high school. Will report damage over the next three days..,,,2017-01-18 04:35:05,0,0,Twitter for iPhone,2932692329,MortonDarrius,Darrius Morton,2014-12-19 22:05:09,St. Olaf '19. aspiring choral conductor.,532,313,"Northfield, MN",
225,821576603545243648,"RT @seanmdav: If you hate America and seek to weaken or damage it, you will always find an ally in progressives like Barack Obama.",,,2017-01-18 04:35:01,155,0,Twitter for iPhone,25451988,em_kay_bee,Melissa Binam,2009-03-20 03:30:46,,145,317,NWA,
226,821576591046283264,RT @librascale_xoxo: don't let American standards damage yo African soul????????,,,2017-01-18 04:34:58,3,0,Twitter for Android,2392703801,IhatteePeople,BrownWithACrown,2014-03-08 03:01:53,A Brown Beauty ?,718,507,Everywhere??,
227,821576585543303168,so hard trying to recuperate the damage that last year did,,,2017-01-18 04:34:56,0,0,Twitter for iPhone,458387370,jennnyx_,Jen?,2012-01-08 14:15:35,,303,120,MD ,
228,821576536994107392,#PremierLeague ?Vertonghen suffers ligament damage?: Tottenham Hotspur's Belgium defender Jan Vertonghen damaged? https://t.co/QaMlCTx0gu,,,2017-01-18 04:34:45,0,0,dlvr.it,444305439,PremierLeague8,Premier League,2011-12-23 03:48:43,"Premier League News 24h !!
Premier League: http://t.co/eNNkhFt23n",1383,1620,,
229,821576530765684737,"RT @d1s9r9s3: @CNNPR @DLoesch The one thing the !st allowes you, Damage done by sloppy journalism put negative statements in public mind. R?",,,2017-01-18 04:34:43,1,0,Mobile Web (M5),744631682339332101,101_Eternity,WE FAINT NOT,2016-06-19 20:43:22,"""No Man is an Island""

We need one another, so I will defend,
Each man as my brother, each man as my friend.
Joan Baez",167,2,,
230,821576529003937793,#PremierLeague ?Vertonghen suffers ligament damage?: Tottenham Hotspur's Belgium defender Jan Vertonghen damaged? https://t.co/tZ64gUp6gs,,,2017-01-18 04:34:43,0,0,dlvr.it,444794817,PremierrLeague,Premier League,2011-12-23 17:07:05,Premier League News 24h !! Premier League: http://t.co/htIHOADEyG,1974,1792,,
231,821576518111522817,"@realDonaldTrump Please be safe, people intend to use ""muriatic acid gas bombs"" at the inauguration. The gas can da? https://t.co/KpMHcrjNSP",,,2017-01-18 04:34:40,0,0,Twitter Web Client,806233590606479361,TrumpTrain11816,God Bless America,2016-12-06 20:27:21,,3,7,,
232,821576508506521600,"RT @Leopard212: #Sabocidents continue on Railway infrastructure. No loss of life, yet.damage to infrastructure, and delay.
https://t.co/dCX?",,,2017-01-18 04:34:38,5,0,Twitter for Android,69225972,devn29,? Hansa,2009-08-27 07:01:14,"CS, ????? ??????, MODIfan, RT dont means endorsed, ???? ????? ?? ?? TL ?? ??? ?? ??? ?? ?????? ????, ?? ?????

gab.ai - Moddev_29",548,1100,????? ?? ?? ????,
233,821576505859997697,RT @JRubinBlogger: Trump has bared his fangs to Merkel. He will do untold damage to Europe | Josef Joffe https://t.co/6sSnp2tmBu,,,2017-01-18 04:34:37,57,0,Twitter for iPhone,919997444,stumblingstudio,stumblingstudio,2012-11-01 23:05:35,Please do not add me to any lists. Thank you.,359,125,,
234,821576495080607744,RT @wfaachannel8: Father shot in Kroger parking lot over car damage https://t.co/izJkrpi0o2 https://t.co/76YojMfyaj,http://pbs.twimg.com/media/C2bTTuKVEAAnDyj.jpg,,2017-01-18 04:34:35,6,0,Twitter for iPhone,221707278,gardencatlady,FrackingTestSubject,2010-12-01 11:39:28,"Love art, birds, peace & cats! Why can't we all love each other & get along, war is a crime.",32126,30138,,
235,821576494044483584,?????????????? CCRm45km h?Ignis damage mitigation brake test CCRm 45 km h https://t.co/qTnpQUfyl4,,,2017-01-18 04:34:34,0,0,twittbot.net,2834860999,YouTube956412,?????????,2014-09-28 08:10:25,,2167,2310,,
236,821576484686962688,RT @ggreenwald: I visited Chelsea Manning &amp; spent countless hours on phone w/her. Damage is palpable. UN found she was abused. Clemency is?,,,2017-01-18 04:34:32,1516,0,Twitter for iPhone,176639982,ManIsFree,Frazier McGinn,2010-08-10 01:52:56,I write.,112,195,California,
237,821576481306353664,RT @JRubinBlogger: Trump has bared his fangs to Merkel. He will do untold damage to Europe | Josef Joffe https://t.co/6sSnp2tmBu,,,2017-01-18 04:34:31,57,0,Twitter for iPhone,716495678873030656,spence_swix,swix_spence,2016-04-03 05:20:56,,223,720,"California, USA",
238,821576473433833472,"RT @bfraser747: ???? #AmericaFirst  

""It is unimaginable how much damage President #BarackObama has done."" ~ @newtgingrich 

#Hannity 
#Ob?",,,2017-01-18 04:34:30,761,0,Mobile Web (M5),43033837,littlebitgood,joanne miller,2009-05-28 03:03:39,,534,111,Alexandria,
239,821576465196208128,RT @wfaachannel8: Father shot in Kroger parking lot over car damage https://t.co/izJkrpi0o2 https://t.co/76YojMfyaj,http://pbs.twimg.com/media/C2bTTuKVEAAnDyj.jpg,,2017-01-18 04:34:28,6,0,Twitter for Android,39843558,diannetaylor09,DianneTaylor,2009-05-13 21:40:22,,112,688,Texas,
240,821576453305221120,"@raffertybaker We are afraid of the world ""kill"". We use ""euthanized"" ""collateral damage"". The fact remains that those animals were killed!",,,2017-01-18 04:34:25,0,0,Twitter for iPhone,1069436948,PMartineauRC,Pierre Martineau,2013-01-07 23:19:42,Journaliste ? Radio-Canada Vancouver,451,270,,
241,821576448846786560,@SincerelyDes___ I had 1 blow out but it didn't come completely straight &amp; I blow dry it but I'm scared of the heat damage with a blow out,,,2017-01-18 04:34:24,0,0,Twitter for iPhone,334776358,bsj_msambitious,bre,2011-07-13 17:09:19,I am a nurse who's also a princess! #uscu16nursing #ripjoshlee,997,849,getting fitted for my tiara,
242,821576448242688000,RT @MKR1MKR2: Damage control #Centrelink staff must hide the truth: https://t.co/NnaHw21Kh5 mafia like organisation #Turnbull #Trudge #labor,,,2017-01-18 04:34:24,3,0,Twitter Web Client,2785300549,CherieAmour999,Cowgirl Up,2014-09-02 05:14:14,Cowgirl up and turn that neoliberal bull before it trickles down all over us I say.,485,534,,
243,821576441485819904,"I liked a @YouTube video from @knoxtheb0x https://t.co/GTRaBx1tdG ""100K Damage"" Destiny: Weekly Nightfall Strike The Sunless Cell Solo",,,2017-01-18 04:34:22,0,0,Google,3123961798,ItzNether,?????????,2015-03-28 14:21:09,Hey My Name is Colin but call me Nether welcome to my account !! Channel Bel,68,206,,
244,821576437597696005,"RT @GoodwinMJ: ""For you the damage will be bigger"" says straight-faced Italian Minister whose banks are shackled with ?350bn toxic loans #n?",,,2017-01-18 04:34:21,25,0,Twitter for Android,337285986,AndrewDocklands,Andrew Osborne,2011-07-17 19:41:38,"People freely trading not Govt Wealth Transfer. Calls Radio Shows exposing Productive vs Parasitic, Warfare/Welfare. State v Individual. Austrian Economics",330,258,Docklands London,
245,821576418240774144,"The arrested men allegedly threatened, pointed guns at the businessman when he alighted from his SUV to check for damage in the collision",,,2017-01-18 04:34:16,0,0,Twitter for iPhone,122607866,anjo_bagaoisan,Anjo Bagaoisan,2010-03-13 08:12:18,ABS-CBN News journalist; media & pop culture enthusiast; Christian.,3036,955,Philippines,
246,821576406245076992,Father shot in Kroger parking lot over car damage https://t.co/XUEshBWzv6 https://t.co/FVLx2jfk15,http://pbs.twimg.com/media/C2bTYokUcAITFVY.jpg,,2017-01-18 04:34:14,0,0,dlvr.it,2161428902,News8Daybreak,News 8 Daybreak,2013-10-28 18:52:34,"News 8 Daybreak is our morning newscast here at WFAA-TV in Dallas, Texas.
Wake up with Ron and Alexa weekdays from 4:30 am to 7:00 am",8917,473,"Dallas, TX",
247,821576403535728641,"RT @seanmdav: If you hate America and seek to weaken or damage it, you will always find an ally in progressives like Barack Obama.",,,2017-01-18 04:34:13,155,0,Twitter for iPhone,47497573,df2727,DF,2009-06-16 00:57:57,Lawyer. Conservative. Patriot.,205,790,Brooklyn,
248,821576400377434113,RT @JRubinBlogger: Trump has bared his fangs to Merkel. He will do untold damage to Europe | Josef Joffe https://t.co/6sSnp2tmBu,,,2017-01-18 04:34:12,57,0,Twitter for Android,289784361,CeCe_23Spalding,Nancy W. F. H. ??,2011-04-29 06:18:39,I've learned that u shouldn't go through life with a catchers mitt on both hands. You need to be able to throw something back.Maya A. #Human #Mom #Wife #INFJ ?,1074,3654,"Brooklyn, NY from Queens",
249,821576399244947456,"RT @GreysAnatmyQ: Losing love is like organ damage, its like dying, the only difference is death ends. This, it could go on forever. -- Mer?",,,2017-01-18 04:34:12,49,0,Twitter for iPhone,1635047352,camrynnjewell,cam,2013-07-31 09:43:41,may we all??sc: camrynnjewell,1165,623,"Roll Tide, AL",
250,821576392966074368,don't let American standards damage yo African soul????????,,,2017-01-18 04:34:10,3,6,Twitter for iPhone,277206574,librascale_xoxo,????,2011-04-04 22:30:29,Beauty in the struggle. Aspiring psychologist. ?,10016,7500,"Indiana, USA | United Center",
251,821576373731033088,"@KaRaRacn75 hell yeah. I enjoy dangerous amount of rain now then snow. More damage?
SAVAGE!!!?",,,2017-01-18 04:34:06,0,1,Twitter for Android,3062311882,jhelm102288,J,2015-02-25 15:16:29,"I'm J-Helm aka psycho. got a kid. I live in western NY & its a shit hole .., keep it metal \m/",791,426,western NY,
252,821576369138241537,RT @GeorgekhouryUN: Conflict has turned #Saada into a devastated governorate with extensive infrastructre damage and massive humanitarian n?,,,2017-01-18 04:34:05,2,0,Twitter for iPhone,749582063523725312,GeorgekhouryUN,George.khoury.un,2016-07-03 12:34:25,Country director United Nations Office for the Coordination of Humanitarian Affairs (OCHA) in Yemen,97,56,Yemen,
253,821576333016911872,RT @MSGAllTrading: Say goodbye to hair problems! Try MSG 9??9 oil that helps in healing hair damage &amp; restore hair to its healthiest form.?,,,2017-01-18 04:33:56,1728,0,Twitter for Android,820605025252679680,Reena81340234,Reena,2017-01-15 12:14:18,,0,8,"Umri, Haryana",
254,821576329292349440,@SenBernie Thanks for your tough questions to Ms. DeVos. She is unfit and an embarrassment who will damage public education,,,2017-01-18 04:33:55,0,0,Twitter for iPhone,4628608049,albarellimar,Marilyn Albarelli,2015-12-28 04:26:48,,3,34,,
255,821576322623254528,"The damage to Melbourne?s reputation as a friendly &amp; safe destination should not be underestimated. My column on...
https://t.co/z7cnlDeJXw",,,2017-01-18 04:33:54,7,15,Twitter for iPhone,25235151,RitaPanahi,Rita Panahi,2009-03-19 04:09:43,"The truth is incontrovertible. Malice may attack it, ignorance may deride it, but in the end, there it is. Winston Churchill",45285,1135,"Melbourne, Victoria",
256,821576321591447553,Father shot in Kroger parking lot over car damage https://t.co/izJkrpi0o2 https://t.co/76YojMfyaj,http://pbs.twimg.com/media/C2bTTuKVEAAnDyj.jpg,,2017-01-18 04:33:53,6,3,dlvr.it,15694286,wfaachannel8,WFAA-TV,2008-08-01 20:46:33,,401340,3890,"Dallas, TX",
257,821576305820901376,@BrooksBeau BEAU one day you're going to have permanent eye damage because of all the things you put in your eyes,,,2017-01-18 04:33:50,0,0,Twitter for iPhone,1335228668,kidinloveliam,lauren,2013-04-07 22:25:55,,4403,110,ella,
258,821576288943087616,RT @JRubinBlogger: Trump has bared his fangs to Merkel. He will do untold damage to Europe | Josef Joffe https://t.co/6sSnp2tmBu,,,2017-01-18 04:33:46,57,0,Twitter for Windows,28051145,meganbbrennan,m b b,2009-04-01 04:32:50,,144,219,,
259,821576284069314560,RT @Cloud9_hz: #growingupwithangerissues.          The psychotic tantrum u get in ur room &amp; have to suffer from cleaning it up when the dam?,,,2017-01-18 04:33:44,43,0,Twitter for iPhone,3264652377,ForeignMiir,nyamir?,2015-05-17 03:27:32,|who hotter than the kid?|,194,215,htx,
260,821576276783857664,RT @Nachos0verHoes: when u overreacted &amp; the damage has already been done so u just lay there wondering why anyone puts up with u at all ht?,,,2017-01-18 04:33:43,48844,0,Twitter Web Client,2790247262,gxldboy_,fuck you i'm famous.,2014-09-04 17:50:24,"in stores & sensational .|| 
#LongLiveSkyler #smokeandpray #mosthiigh .",25948,4916,"Chicago, IL",
261,821576265127706624,Why Trump's False 'Voter Fraud' Claims Will Do Lasting Damage - The Atlantic https://t.co/YugRqJVyyh,,,2017-01-18 04:33:40,0,0,Mobile Web (M2),820704637800083456,QuiTamGuru,Qui Tam Guru,2017-01-15 18:50:08,Know your rights--your comprehensive source for the latest #whistleblower news!,1236,345,"Lewiston, NY",
262,821576258303696896,RT @JRubinBlogger: Trump has bared his fangs to Merkel. He will do untold damage to Europe | Josef Joffe https://t.co/6sSnp2tmBu,,,2017-01-18 04:33:38,57,0,Twitter for iPhone,821035887530311685,OjPats4,OJ Harrison,2017-01-16 16:46:24,I hate Russia with all of my heart. George Smiley is my hero. ????,7,52,,
263,821576235662897152,"don't throw yourself around from heartbreak to heartbreak acting like the damage doesn't matter, cuz when u get to your wifey/hubby IT WILL.",,,2017-01-18 04:33:33,0,0,Twitter for iPhone,2418700745,jayjay_boyce,jayda,2014-03-17 23:13:03,"Mover of mountains, singer of songs, reader of books. I exist to pour back praise. let's be friends. check out my blog for young ladies!",886,467,TX | NC ,
264,821576233678798848,Hooping every day really does some damage to my body. Guess it's for the love of the game.,,,2017-01-18 04:33:32,0,1,Twitter for Android,849738264,topherburian,Topher,2012-09-27 18:37:01,Strive For Greatness - CWU,751,232,,
265,821576223293894657,"@justsay_sy nah fr, now if I woulda said something about her having little teeth with a fat ass head with heat dama? https://t.co/SQILdLSHgI",,,2017-01-18 04:33:30,0,3,Twitter for iPhone,1649113472,capturecurrency,chloe?,2013-08-06 01:11:14,,405,257,,
266,821576216830427136,?? Extra Strong Pro SkinLightening SkinWhitening Cream Bollywood Skin care Cosmetics https://t.co/LqaCr9fLpb https://t.co/p8FJURSZDc,http://pbs.twimg.com/media/C2bTNtyXcAArsW8.jpg,,2017-01-18 04:33:28,0,0,Tweet-Eye Web Application,719866989481746433,jollycosmetics3,Bridgett Devine,2016-04-12 12:37:19,,37,95,,
267,821576212740980737,@HermosoMichaela it's probably from chemical damage as well that can fry the hair changing the texture. Try some protein treatments,,,2017-01-18 04:33:27,0,0,Twitter for iPhone,59709272,harlzautry,Harley Autry,2009-07-24 06:23:29,Leo | 20 | Messy,363,93,Hate City,
268,821576211042332672,RT @JRubinBlogger: Trump has bared his fangs to Merkel. He will do untold damage to Europe | Josef Joffe https://t.co/6sSnp2tmBu,,,2017-01-18 04:33:27,57,0,Twitter for iPad,746778695130558464,Amb0306,Alice bobra,2016-06-25 18:54:50,,264,674,,
269,821576209364615169,@5abrin8b I hv RA PsA &amp; Fibromy. Bone spurs up n dn my spine causing xcruciating nerve damage,,,2017-01-18 04:33:27,0,1,Twitter for iPhone,748087722246549504,Darthalene410,Dot,2016-06-29 09:36:26,,43,342,United States,
270,821576203719077889,"@southernon_wx there was some damage along trafalgar road just north of hillsburgh, similar sized branches; that's it i've seen",,,2017-01-18 04:33:25,0,0,Twitter Web Client,2561570224,KayBeWx,Kayla,2014-05-24 07:19:22,CANWARN storm spotter. Weather enthusiast. Nature and animal lover & budding photographer. Photos may not be used without my permission.,632,258,,
271,821576195439464448,Throw back to when Tommy wrecked the gator and did 8 thousand dollars worth of damage to it Coach Stump was pissed,,,2017-01-18 04:33:23,2,5,Twitter for iPhone,586127044,morrow_t,Steelers SBLI Champs,2012-05-21 00:59:48,Texas Forever,602,353,,
272,821576193795362817,?? Extra Strong Pro SkinLightening SkinWhitening Cream (RED)  Bollywood Secret https://t.co/UYBZe43jEy https://t.co/xU3aEygS4V,http://pbs.twimg.com/media/C2bTMVIW8AEtF8U.jpg,,2017-01-18 04:33:23,0,0,Tweet-Eye Web Application,3040645270,JollyCosmetics2,Jolly Cosmetics II,2015-02-16 12:07:43,"Jolly Cosmetics II has the best in Asian Skin Lightening Creams & Serums, Anti Aging & Acne Treatment Creams.",7131,1095,"London, United Kingdom",
273,821576178255405056,RT @JRubinBlogger: Trump has bared his fangs to Merkel. He will do untold damage to Europe | Josef Joffe https://t.co/6sSnp2tmBu,,,2017-01-18 04:33:19,57,0,Twitter for iPhone,39702190,Islandmike13,Mike Steidl,2009-05-13 06:25:39,"Interested in politics, sports, history, entertainment and just about anything else under the sun.....Browns Fan, Tribe Fan, lukewarm Cavs Fan :)",274,561,"North Ridgeville, Ohio",
274,821576158068310024,@MeliMelWilson ABUSE! ABUSE! I had brain damage!! I still doooooo! loll,,,2017-01-18 04:33:14,0,1,TweetDeck,332229447,Kaden_Kessler,Kaden Kessler,2011-07-09 12:54:19,? Father Of @lilbits_kessler ? Fights Part Time For @HonorWrestling.?,1527,709,"Southampton, NY",
275,821576150795382788,I can't stand doing hair but I be putting so much effort into them clients yo ?. I really be hurt when they damage they hair.,,,2017-01-18 04:33:13,0,0,Twitter for iPhone,550512396,_danimaals,?.,2012-04-10 20:41:52,myrtle XI-V-MMXVI #restinpeacebward #TU20 ??,1688,476,,
276,821576134127185921,RT @girlhornyalways: This is likely to cause some damage .. https://t.co/dJEshtcje5,http://pbs.twimg.com/media/C2Hmtk0WIAADqaI.jpg,,2017-01-18 04:33:09,30,0,Twitter for Android,4225116837,junglekkat1,blackkat,2015-11-19 09:09:53,"Black is Golden.
DM me and send nudes.",2037,145,,
277,821576128360022016,"@FinalOverdrive or widen existing holes, does incredible damage to that image - at least for the more public right. Other powers",,,2017-01-18 04:33:07,0,1,Twitter Web Client,184469967,EBBerger,Edmund Berger,2010-08-29 16:58:30,anarchist. anti-fascist. independent writer + researcher. grungy accelerationist and unrepentant globalist. no borders no masters,223,218,"Louisville, KY",
278,821576118163542016,RT @JRubinBlogger: Trump has bared his fangs to Merkel. He will do untold damage to Europe | Josef Joffe https://t.co/6sSnp2tmBu,,,2017-01-18 04:33:05,57,0,Twitter for iPhone,754041302908440577,PoliticsPoorly,PoorlyDrawnPolitics,2016-07-15 19:53:50,Poorly drawn political conclusions,58,200,,
279,821576114195877888,RT @JRubinBlogger: Trump has bared his fangs to Merkel. He will do untold damage to Europe | Josef Joffe https://t.co/6sSnp2tmBu,,,2017-01-18 04:33:04,57,0,Twitter Web Client,149763376,purrmonsta,Puri Monsta,2010-05-30 04:44:02,"RETWEET=FYI, NOT always AGREE. Democrats &friends UNITE to SAVE USA& PLANET! DO NOT ADD ME TO LISTS WITHOUT PERMISSION #TheResistance",591,654,United States,
280,821576097867309056,Best Available Environment Minister in Caucus. Give us 4 more years to repair the damage! https://t.co/0e1s6XiIsC ?? https://t.co/yCI2CMkjVV,,,2017-01-18 04:33:00,0,0,Twitter Web Client,816509876583047168,Minumuss,Minimus,2017-01-04 05:01:39,A $15 million taxpayer-funded ad campaign isn't quite enough to keep our Great Leader in office. That's why I'm helping. Oink oink. Re-oinks appreciated!,36,125,,
281,821576096248430592,Even aftert Trudeau is dumped the damage to the economy will have to be repaired.  https://t.co/LSsZbtDFUo https://t.co/WONkERjEWd,http://pbs.twimg.com/media/C2bTGp_XgAApO3n.jpg,,2017-01-18 04:33:00,4,0,Pullquote: save and share quotes,66112820,Calculator60,Ronald Beer,2009-08-16 13:13:13,"Raised on the prairies. Canadian blood, Irish heart",821,714,Central Okanagan Valley,
282,821576085544562688,RT @SoDamnReaI: when u overreacted &amp; the damage has already been done so u just lay there wondering why anyone puts up with u at all https:?,,,2017-01-18 04:32:57,384,0,Twitter for iPhone,921632143,Shakurswifee,claudia ?,2012-11-02 19:28:21,Princess Aaliyah ??,524,494,,
283,821576083376054272,"*Curly gets some coffee brewing downstairs; luckily, the trusty contraption was spared any damage.*

*It may be a long night for all.*",,,2017-01-18 04:32:57,0,0,Twitter for iPad,763876835063164929,mlp_ANocturne,Azure Nocturne,2016-08-11 23:16:44,"Tireless, playful Open Hooves caretaker, capable of handling the little ones & talented with a song. ((RP Sparkly, GMT-5)) [New ponies, please read the OH Wiki]",425,202,Open Hooves Orphanage - PV,
284,821576049188171777,"Also, the Justice Dept said Petraeus' leaks would have caused ""grave damage"" if revealed, and he didn't even get a sentence!",,,2017-01-18 04:32:48,0,0,Twitter for iPhone,401789571,MiaBoardmanSmit,Mia Boardman Smith,2011-10-31 02:49:57,Seriously?,190,131,"solana beach, ca",
285,821576035133075456,#DeVosHearing time to call your representative tomorrow morning. She will damage the opportunities for many children left behind if voted 4,,,2017-01-18 04:32:45,1,1,Twitter for iPhone,801945415025201152,usa_concerned,J.C.,2016-11-25 00:27:41,,3,51,,
286,821576032604012544,@SincerelyDes___ heat damage ?,,,2017-01-18 04:32:44,0,0,Twitter for iPhone,334776358,bsj_msambitious,bre,2011-07-13 17:09:19,I am a nurse who's also a princess! #uscu16nursing #ripjoshlee,997,849,getting fitted for my tiara,
287,821576030225776640,"""State looks to fund effort to combat invasive mussels"" https://t.co/w1N9Hefv1i #mussels #damage #environment",,,2017-01-18 04:32:44,0,0,Twitter Web Client,282716700,JoanneSpruceC21,Joanne Spruce,2011-04-15 19:31:16,"world traveller, philanthropist, break dancer, cookie chef ...  but really, just a real estate broker/agent",1440,1259,"Vernon, British Columbia",
288,821576028388814852,"RT @TrekSegafredo: Ouch. Mads did get up and finish, so hopefully that means no significant damage. https://t.co/1uNxbu0CLW",,,2017-01-18 04:32:43,5,0,Twitter for iPad,1605692672,Marinadocka,??????,2013-07-19 11:08:27,,278,354,,
289,821576026413273092,"I liked a @YouTube video https://t.co/AMowBU5bOv DOUBLE 3200 DAMAGE ASSASSINATES ? SingSing Moments Dota 2 (Jan 17, 2017 Stream)",,,2017-01-18 04:32:43,0,0,Google,4106938998,Peasant_Squad,Sam Benson,2015-11-02 23:54:46,"Engineer of Procrastination and chemicals. Also a king of SEA youtube, feel free to check Peasant Squad out!!
https://t.co/9MkmhuUwts",136,335,"Perth, Western Australia",
290,821576024379035648,RT @ggreenwald: I visited Chelsea Manning &amp; spent countless hours on phone w/her. Damage is palpable. UN found she was abused. Clemency is?,,,2017-01-18 04:32:43,1516,0,Twitter for iPhone,335097017,FelipeKaut,FelipeKaut,2011-07-14 04:20:51,Arsenal Supporter. From Costa Rica. Pura Vida!,225,195,"Arlington, VA",
291,821576012890836992,RT @ms_erika74: I survived  #TheObamaYears even though he did everything in his power to destroy America. Thank God we can now start to rep?,,,2017-01-18 04:32:40,1039,0,Twitter for Android,773740631101497344,RAPMDarin,RDarin,2016-09-08 04:31:56,"The truth is neither to the left or to the right, but somewhere in the middle. 

RT not endorsement. 

On gab at https://t.co/4nQopLnC2m",314,288,,
292,821576011724759041,@RogerWicker @POTUS. US officials privately say WikiLeaks damage limited. https://t.co/xX7an4uGd3,,,2017-01-18 04:32:39,0,2,Twitter for iPhone,627348977,STL_Phil,Phil O'Regan,2012-07-05 12:36:21,,4,55,"Southaven, MS",
293,821575985539727360,RT @peterdaou: 1. Bernie did more damage to Hillary's reputation in a few months than Republicans did in 30 years. He is part of the reason?,,,2017-01-18 04:32:33,1814,0,Twitter for iPhone,306832456,bpt326,Brian,2011-05-28 14:39:26,"#LGBT American. Progressive. Wright State University alumni. Entertainer, living in Orlando. Born and raised in Cincinnati #LoveWins #ImWithHer #OrlandoUnited",1229,2959,"Orlando, FL",
294,821575980619853825,RT @itomkowiak: According to Republicans the only people who are allowed to release confidential information are those who are doing damage?,,,2017-01-18 04:32:32,5,0,Twitter for iPad,2421228369,TyberZannxxxx,Andy Bowman,2014-03-18 23:13:00,Unemployed; Former Camden County College student,1063,4999,"Laurel Springs, NJ, USA",
295,821575972528877568,RT @WGLNA: .@eClipse_WGLNA takes the overtime victory over @AquaticM60s. Here are your post game damage numbers! #WGLNA https://t.co/iO0sCv?,,,2017-01-18 04:32:30,6,0,Twitter for Android,870938108,KAWorkbench,Krafter [PACNW],2012-10-10 01:56:39,Gamer playing @worldoftanks - Username: KrafterAnonymous | Recruiter for the @PACNWTankers Clan | @WGLNA Twitch Modmigo | SEAHAWKS! | #SupportOurTroops | ?,1282,2191,"Washington, USA",
296,821575972021473280,"Huge damage coming out from Tapu Fini here, right onto the Celesteela!",,,2017-01-18 04:32:30,0,0,"Cheap Bots, Done Quick!",815582335609569286,vgcstreambot,vgc commentary bot,2017-01-01 15:35:56,posts randomized quotes that sound like they're from vgc streams // made by @profshroomish,133,1,,
297,821575969454424064,"RT @MarlEmergency: If your home/property suffered damage in the 14 Nov quake, don't forget the deadline for lodging a claim is 14 Feb: http?",,,2017-01-18 04:32:29,4,0,Twitter Web Client,214714057,EQCNZ,EarthquakeCommission,2010-11-12 01:50:29,"EQC is a government agency providing natural disaster insurance for NZ residents, as well as funding natural disaster research and public education programmes.",5208,941,New Zealand,
298,821575964429729792,My definitely got longer since all that damage I did to it when I went blonde,,,2017-01-18 04:32:28,0,0,Twitter for iPhone,607498107,Vinaandreaa,v,2012-06-13 18:00:17,"whoever threw that, your mothers a hoe",1654,1334,,
