,id,text,media_url,video_url,created_at,retweet_count,favorite_count,source,user_id,user_screen_name,user_name,user_created_at,user_description,user_followers_count,user_friends_count,user_location,user_coordinates
453,821573634246508545,I love my @Fleksy Keyboard! I'd like to see even more #FleksyExtensions!,,,2017-01-18 04:23:13,0,0,Twitter Web Client,821570458159968256,damage_evil,Damage.evil.inc,2017-01-18 04:10:36,A regular box of fun I is.,1,37,,
454,821573627694948352,Cutting-edge molecular profiling analyses reveal that the popular weedkiller Roundup causes serious liver damage... https://t.co/qr7OeoVlHt,,,2017-01-18 04:23:11,1,1,Facebook,15985487,DrHardick,Dr. B.J. Hardick,2008-08-25 18:54:23,"Co-Author, @Max_Living Nutrition Plans. Advisory Board, @GreenMedInfo. DC at @HardickChiroCtr #LdnOnt | #RealDetox free e-Book: https://t.co/bx4IzRrP5o",4653,473,"London, ON",
455,821573613669191683,RT @sbingner: Why pardon Bradley Manning? He is an actual traitor. How about somebody like the guy who took a picture inside a sub and didn?,,,2017-01-18 04:23:08,2,0,Twitter for iPad,35777353,Jrpd373,Michael Owens,2009-04-27 15:58:11,"I am an Adventurer, a rugged Individual, and a lover of Liberty.",126,241,All over,
456,821573593092001793,"ASPARAGUS 
Rich in folate &amp; an aphrodisiac
High levels of glutathione, which minimizes skin damage, protects &amp; repa? https://t.co/x74IhPa0gW",,,2017-01-18 04:23:03,1,4,Twitter for Android,1096224391,fit_with_hips,clarinet  ?,2013-01-16 20:08:17,"embracing the positive side of veganism?
intuitive eating, weight lifting loving, music teacher who spends too much time tweeting memes.",6299,987,"Milwaukee, WI",
457,821573581440221184,"Please. Call your reps this instant. She may not be scariest appointment, I'll argue she's poised to do the longest? https://t.co/tPNPxFpHjx",,,2017-01-18 04:23:00,0,2,Twitter Web Client,1187828928,TheERRose,Emma Rose Ryan,2013-02-17 00:05:45,My Goal: somehow monetize the drinking of tea and reading of books. Writing is my fallback career. Writer. Library Worker. Friend. (of @Ch1Con & others) DFTBA!,315,768,I help run the @ch1con tumblr!,
458,821573557398343680,?????????????,,,2017-01-18 04:22:54,0,2,Twitter for iPhone,2336936094,Damage_inc1993,???????,2014-02-10 16:25:45,???,58,61,yellow submarine,
459,821573551186706433,@HKanade_ Let's try to save you a trip. Just a few questions. Are you using original charger? Any water or physical damage?^DK,,,2017-01-18 04:22:53,0,0,Sprinklr,62601419,VZWSupport,Verizon Wireless CS,2009-08-03 19:37:53,"Questions about your Verizon Wireless service? We?re here to help 24 hours a day, 7 days a week! ?Ahora en Espa?ol! F?cil, r?pido y en su idioma.",210683,15391,,
460,821573548779175937,"@Sync_AE i like the Void Highlord Class, makes a lot damage, but the heal is a lil bit low.",,,2017-01-18 04:22:52,0,0,Mobile Web (M2),814381839624212481,KimKim_AE,Kim Kim AE,2016-12-29 08:05:35,"Pixiv and Deviantart illustrator. An otaku artist, feel free to request your favorite anime. I will draw it for you.",7,70,,
461,821573524619935748,.@psychopappy1961 @SenSchumer @timkaine She wants to be in charge of educating children. Those ripples of damage will expand for decades...,,,2017-01-18 04:22:47,0,0,Twitter Web Client,59817197,carver76,John Stemple?,2009-07-24 16:01:09,Would that it t'were so simple...,320,999,Omaha,
462,821573506290700288,@I53N8 REMEMBER IN LIKE 2010 OR W/E WHEN HEECHUL WENT OFF TO WAR that was tha most emotional damage i ever took,,,2017-01-18 04:22:42,0,1,Twitter for iPhone,2414979157,misandrism,misandrism,2014-03-27 22:31:27,*pays for 9th consecutive lap dance from the same stripper*?so then Sam...get this?he literally PICKS UP FRODO and carries him up the mountain,1484,545,,
463,821573493447856133,RT @pettylabelleee: her waistline small &amp; that booty lil damage ?,,,2017-01-18 04:22:39,1,0,Twitter for iPhone,3958203388,HaileyAsplund,Hailey,2015-10-14 18:29:14,live life to the fullest | 9.17.16 ?,398,293,"Milwaukee, WI ??9??",
464,821573473076187136,Rolling up from a standing forward bend can damage your spine https://t.co/CeyaqEizFi,,,2017-01-18 04:22:34,0,0,Twitter Web Client,213078168,LeAMH76,LeAnne Marie,2010-11-07 22:25:53,"passionate blissful yoga teacher, striving for a peace with all people and beings!",125,207,Canada,
465,821573465991876608,"RT @chaotici_anti: ??INFO??
??? Selfish????????""
1/21(?)@ ???????
w/KING BROTHERS,THE LEFTY,DAMAGE,COUNTPHANTOM,TUTTLE,NAGUY,SCUMZONE,TARAC?",,,2017-01-18 04:22:33,17,0,Twitter Web Client,802938816,tarach1ne,TARACHINE,2012-09-04 18:23:50,"???????mother fxxkin' DJ???????????????????  ????????/??????/T.F.C??/COCHLEA./ROOM19/???????????????
???????????????????????????????????DM?????????",1236,1425,,
466,821573465505312769,"RT @RichSimmondsZA: What others say about you is their business ... Only your response can damage your brand, You are the risk yourself!",,,2017-01-18 04:22:32,30,0,Twitter for Android,1256857411,yaaasssgail,??egail ?ndales ?,2013-03-10 12:02:51,"IG: @yaaasssgail
?: To see the ? is to overlook the ? & to see the ? is to overlook the ?  #heartclub
?:Born to travel ? ?Foodie ? ?Feminist ? ?SCORPIO",1010,636,"Bacoor City, Cavite",
467,821573458546999296,"RT @HarveyStaub1: Every day, Obama does damage to America. Every day.",,,2017-01-18 04:22:31,3,0,Twitter for iPad,795738730493460480,poodbit499,Jenny,2016-11-07 21:24:32,"Former democrat, trying to make up for years of mindlessly voting democrat tickets. My goal-Convert as many democrats as I can before I die. #TRUMP/PENCE #MAGA!",717,1289,"Nevada, USA",
468,821573455342698500,"Huge damage coming out from Garchomp here, right onto the Tapu Fini!",,,2017-01-18 04:22:30,0,0,"Cheap Bots, Done Quick!",815582335609569286,vgcstreambot,vgc commentary bot,2017-01-01 15:35:56,posts randomized quotes that sound like they're from vgc streams // made by @profshroomish,133,1,,
469,821573442856226816,????? ??????? ??????? ?????? ?????? ???? 2013: ??????? ??????? ???? ?????! https://t.co/zanjiSo6OM #????????,,,2017-01-18 04:22:27,0,0,SocialOomph,2320679959,foster_b_52,?????,2014-01-31 11:50:20,Parody,499,0,,
470,821573420026654720,RT @AStrongUSA: Chelsea Manning #Wikileaks Sentence Commuted - I guess leaks are OK with Obama if they damage US military interests. https:?,,,2017-01-18 04:22:22,24,0,Twitter for Android,740196730843607040,7leaf3,7Leaf 4 TRUMP!!!!!!,2016-06-07 15:00:27,I support the PRESIDENT! DONALD J TRUMP!  of the United States of America! I pledge my allegiance! GOD! COUNTRY! PRESIDENT! GOD BLESS AMERICA! AMERICA FIRST!,1038,2106,THE GREAT STATE OF INDIANA!!!!,
471,821573411067396097,Not like you haven't done enough damage to my heart please keep playing. Push someone maybe you'll feel better.,,,2017-01-18 04:22:19,0,0,Twitter for iPhone,3633069318,KacieThompson6,kacie.,2015-09-21 02:28:39,"aw, fuck son. | SC: kacie_jordon",91,235,,
472,821573409343733760,@ArmedCalfMKX @Cossner Wait until you get to the combo damage.,,,2017-01-18 04:22:19,0,0,Twitter Web Client,3562308209,BxA_Ragnarok,Ragnar?k,2015-09-06 03:58:32,"Competitive Fighting Game player, sponsored by @BxAGaming. Co-Leader of Ruthless Mayhem.  https://t.co/kZtWCxBCCC",152,96,,
473,821573396593016832,@thed1judgement d1 execution just did 2.5k damage in 20 mins as Fenrir. I'm glad he's not in Bald,,,2017-01-18 04:22:16,0,0,Twitter for iPhone,1688438096,bazz_2013,"""Baz2013""",2013-08-21 14:20:26,,251,234,,
474,821573393187094528,(Sacbee) #Sierra residents alerted to potential damage from heavy snow loads : With another series of storms.. https://t.co/kVLSMdslwN,,,2017-01-18 04:22:15,0,0,Java to Twitter,4289485636,inusanewscom,InUSANews.com,2015-11-26 21:38:57,"InUSANews is a news aggregator, it gathers news from different sources, and continuously monitor breaking news from multiple news websites.",1036,168,,
475,821573391249510400,RT @ggreenwald: I visited Chelsea Manning &amp; spent countless hours on phone w/her. Damage is palpable. UN found she was abused. Clemency is?,,,2017-01-18 04:22:15,1516,0,Twitter for Android,49748308,PyroBatNL,?,2009-06-22 20:10:45,"IT, infosec, privacy, veiligheid, protestantisme,
Politiek: SP
FPM: vuurwerk, explosieven, chemie
 #vliegmuisjes #nieuwsgierig #ingress #LEGO",2049,1778,Holland... ,
476,821573383028637698,"RT @EWErickson: Damage the DNC with leaks: our democracy is at stake.

Damage national security with leaks: Democrats want you pardoned.",,,2017-01-18 04:22:13,385,0,Twitter for iPad,273456262,buongiorno9,(((COMRADE SNARKY))),2011-03-28 14:41:38,I'm a first-time Mommy Bear who misses the original Kentucky Fried Chicken recipes of the 80s.,1150,485,"We done, bitches",
477,821573378586853380,"Her Thunder Shot balances out how much damage it does by having shot delay.

The homing fire is top-tier and Ice Cube has BIG coverage.",,,2017-01-18 04:22:12,0,0,TweetDeck,21375440,djDTHTRP,?D.J.?/ Yorihiko,2009-02-20 04:58:04,"D.J. = RL. Music, #TranceFamily. Activist, writer, gamer + anime/manga. || Yorihiko = MV OC RP https://t.co/8IUABWE1E0 @Tita__Nium is wife.",1064,1918,NEPA,
478,821573364997386240,"RT @BeingMahala: This absurd tax can permanently damage India's reputation. Read why? 
#Captain_???????_???? 
#Congress Remove BJP
 https:/?",,,2017-01-18 04:22:08,10,0,Twitter for iPhone,821057105415327749,JanSewakHoodaJi,HaryanaWithHoodaJi,2017-01-16 18:10:43,???? ????? ?? ?????????? ???? ???????? ???? ?????? ?? ?? ??? ????? ???? ?? ?????? ?? ??? ?? ???????? ?? ???? ?? ???? ???? ?? ?????? ?????? ???? ???,1,12,India,
479,821573355841220609,RT @ForQ2: Retweet if trump is a fucking lying racist traitorous incompetent jackass who will damage America @realDonaldTrump https://t.co/?,,,2017-01-18 04:22:06,44,0,Twitter for iPhone,19078054,mercmcl,?,2009-01-16 18:12:47,Clinton won the popular vote by 2.9 mil votes. Largest margin in history #neverdonald #unpresidential ??,160,200,United States,
480,821573271871164422,"RT @PMensah_: He's supposed to keep in good physical shape for himself with you fawning over him , like collateral damage",,,2017-01-18 04:21:46,12,0,Mobile Web (M5),33683431,NoDira_NoFun,Nadira,2009-04-20 22:05:35,meet me at the top,944,826,,
481,821573251709009920,"I tried to mend what I tore
But the damage was done",,,2017-01-18 04:21:41,0,0,Twitter for iPhone,86436157,Roger_Tht_Kevon,Epicurus,2009-10-31 01:16:53,Sluggish. Lazy. Stupid and Unconcerned,861,541,Sky High Iced Out Paradise,
482,821573239923085312,RT @WGLNA: .@eClipse_WGLNA takes the overtime victory over @AquaticM60s. Here are your post game damage numbers! #WGLNA https://t.co/iO0sCv?,,,2017-01-18 04:21:39,6,0,Twitter Web Client,1347677828,BTed72,BTed72,2013-04-12 20:32:27,An average World of Tanks player and Sci Fi fan for.... a long time. Started gaming when it was on paper and called D&D. Also a big fan of WGLNA.,868,971,SF Bay Area,
483,821573209015234560,RT @LivingBlueinRed: If someone has some free time over the next 4 years and a pen laser we could probably keep Trump distracted enough to?,,,2017-01-18 04:21:31,13,0,Twitter for Android,3938162955,BDS_Girl,Jahn,2015-10-12 15:27:41,"A humanist & vegetarian, my beliefs are rooted in science & facts. I believe in equality, ecology, animal rights & BDS with a low threshold for BS.",61,260,"California, USA",
484,821573201822040065,RT @exjon: Obama will side with WikiLeaks when they damage the US military instead of the DNC. https://t.co/ubjqsMeil1,,,2017-01-18 04:21:30,404,0,Twitter for iPhone,83564737,slightstrider,SlightStrider,2009-10-19 09:52:29,And with His stripes we are healed. Overqualified college grad. Waterboarding P.C. 1 tweet @ a time. Connoisseur of beer and Texas Toast.,827,1158,"San Francisco, CA",
485,821573169089802241,"The world has no choice but to seek greener, more sustainable forms of energy. We might as well do it now and avoid? https://t.co/JZ4mjVwCzy",,,2017-01-18 04:21:22,0,0,Twitter for iPhone,2988769528,White_Jade_Tea,??,2015-01-21 03:16:50,"In a gentle way, you can shake the world.",427,340,Water Tribe,
486,821573148214697985,RT @SaneVaxx: Published study confirms MMR vaccine damage in five year old child. https://t.co/JhHGCJFpfs,,,2017-01-18 04:21:17,4,0,Twitter for iPhone,15267738,amcquinn,amcquinn,2008-06-29 02:34:55,"Pract. of Heilkunst Med. treating Autism (http://t.co/xhoeGVb7nr) by Skype, Author of books (http://t.co/dc5QH6oe02), Eco-Builder (http://t.co/QnfRyEi0hl)",820,394,"Saint John, New Brunswick",
487,821573120469274624,For Sale:  2001 LAND RANGE ROVER DISCOVERY 2.5 TD5 DIESEL MANUAL NOT SALVAGE DAMAGE https://t.co/PatFegDuj0 #landrover,,,2017-01-18 04:21:10,0,0,dlvr.it,2176833920,landrovers4sale,Land Rovers 4 Sale,2013-11-05 21:23:08,We list Land Rover cars that are for sale. It's a handy way to see what's out there. No more trawling eBay. We'll keep you updated.,191,10,,
488,821573115217985536,RT @TOMORROWNEWS199: Trump has bared his fangs to Merkel. He will do untold damage to Europe | Josef Joffe https://t.co/mIVoW7GJ0c ? see he?,,,2017-01-18 04:21:09,1,0,Twitter for Windows,2997027117,copperpineinc,Christopher Anderson,2015-01-25 02:04:45,CopperPine Inc. #Conservative #Vet #Patriot #Bluehand #TCOT #NRA #PJNET (Retweets not an endorsement. Tweets not solicitation of services or investment advice.),3378,4766,"Salt Lake City, Utah",
489,821573099879538689,@OathKeeper101st  Praying he gets treason charges!! Hate to pay the SOBs pension after all the damage he has done to America!! ?,,,2017-01-18 04:21:05,0,0,Twitter for iPhone,3129582658,Justicegroupie2,United We Stand ??,2015-03-30 18:08:46,100% Trump! Time to Make America Great Again?? God Bless America??Trump Pence 2016?? Periscope/ @Justicegroupie2,2371,2703,,
490,821573079281172480,"RT @EWErickson: Damage the DNC with leaks: our democracy is at stake.

Damage national security with leaks: Democrats want you pardoned.",,,2017-01-18 04:21:00,385,0,Twitter for Android,49367983,Shanghaibeast,Extremely Careless,2009-06-21 17:19:00,Resistance to Government is just as important a principle of justice as the maintenance of government.*******Reinhold Niebuhr,1154,1150,,
491,821573076328411136,RT @Deevilsadvocate: @DelLerit and core anays not allowed to post on SM muna.. pinagbawalan daw pti pagpunta sa BW. Damage control for the?,,,2017-01-18 04:21:00,9,0,Twitter for Android,80546052,missingMJsomuch,MichelleMyBelle,2009-10-07 10:35:53,"I support Nicomaine Dei Mendoza.No one ask you to follow me.If you have a different view then you're not welcome here.MY WALL, MY TWEETS. Team Mulat/Team Maine",506,826,,
492,821573048797163522,RT @BrePaige17: @alexiamorgannn lol judging by the damage we done last year... bell county isn't ready ???,,,2017-01-18 04:20:53,1,0,Twitter for iPhone,908448547,alexiamorgannn,Lex,2012-10-27 16:27:08,Loves Jesus and America too ? Find me where the palm fronds are,1041,465,"Sunshine State, FL",
493,821573044502196224,#Finger injury to delay Mushfiqur's return # Neck scans revealed no damage but Mushfiqur Rahim has been ... -? https://t.co/w0MzjPJ7CA,,,2017-01-18 04:20:52,0,0,IPL Website ,2994850966,CricketT20IPL,IndianPremierLeague,2015-01-23 21:10:55,Grab all the latest headlines and updates of the T20 Indian Premier League,1733,96,India,
494,821573031655014400,right when things are looking better I just find out more and more like. I'm ab to do some damage?,,,2017-01-18 04:20:49,0,0,Twitter for iPhone,3388510274,tekaari_,Tk$,2015-08-30 03:39:37,II Corinthians 5: 7 | FHS '18 | $avage $eason | #The402 ?,691,453,Trenches,
495,821572989863006209,"and @Zansam did the most damage. it was him, fizz and me, all the work https://t.co/vLsZ7z3A6B",http://pbs.twimg.com/media/C2bQRmKXUAAe1NO.jpg,,2017-01-18 04:20:39,0,2,Twitter Web Client,26316595,nothingxs,Andres,2009-03-24 20:32:14,"Head TO (EVO). TO (CEO, Combo Breaker). FIU Alumni. Let me run your tournament. Tweets only represent my views.",2225,2545,"Miami, FL",
496,821572986972966913,@mairichaimbeul Damage needs to be inspected at the airport: https://t.co/N1ZODeIvaS. You will need to speak with an agent there. ^EB,,,2017-01-18 04:20:38,0,0,Lithium Tech.,260907612,united,United,2011-03-04 21:23:11,Conversations with you here are 140 characters-friendly. Tweet us any time. For a formal response visit https://t.co/cpgjUnDsve.,868972,46853,,
497,821572970460151812,RT @EntheosShines: @mhoward48 There were other cases across the USA of propane tanks being stolen around the same time.  Could be very very?,,,2017-01-18 04:20:34,3,0,Twitter for iPad,3110265579,cherylswenson,Cheryl Swenson,2015-03-24 13:22:29,"salon owner/  ,Mixed Media Artist,GOD,FAMILY,COUNTRY. #TrumpPence16, Trump supporter all the way. LETS GET OUR COUNTRY BACK?",872,1057,"farragut, tn",
498,821572941494173696,Lol...the damage he has inflicted. That statement alone is laughable. How do you measure damage to the country?? Lo? https://t.co/tIix4eRe9C,,,2017-01-18 04:20:27,0,0,Twitter for Android,253862651,TooReal4ThisApp,Nat Burner,2011-02-18 03:33:46,Fuck is you worried about me for???,4456,1923,Southern Cali,
499,821572940676399104,The damage. https://t.co/NZnYVPiMv3,http://pbs.twimg.com/media/C2bQOc7UQAAyim-.jpg,,2017-01-18 04:20:27,0,1,Twitter for Android,77894104,Drawertogether,Justin,2009-09-28 01:56:04,,165,406,,
500,821572928307363840,"But even if some ppl had been killed, collateral damage is acceptable when the action is the right one.",,,2017-01-18 04:20:24,0,0,Twitter Web Client,3669231501,DurinnMcfurren,Durinn McFurren,2015-09-16 00:29:10,"A rabbit & his SocDem econ/environment, else libertarian, vegan, atheist, environmentalist, gamer human. #WildStar #WoW #NeverHillary",923,850,,
501,821572923878207496,RT @mattmfm: Justifying potentially chronic unethical behavior by saying it didn't make the person much money is an interesting choice of d?,,,2017-01-18 04:20:23,127,0,Twitter for iPhone,7413852,pamelagmullins,pamela mullins,2007-07-11 22:03:51,Searching for the next questions to ask.  | Photographer | Writer | Artist,511,406,"North Carolina, USA",
502,821572904739442688,Neil Young - Needle And The Damage Done (Unplugged) https://t.co/uixmk2Bv2q via @YouTube,,,2017-01-18 04:20:19,0,1,Twitter Web Client,4790376622,SherylLRouisse,SherylRouisse,2016-01-13 03:21:24,"?Here we are, the most clever species ever to have lived. So how is it we can destroy the only planet we have?? 
? Jane Goodall",1070,3862,sweetrelief.org,
503,821572903665684481,"alty wellington design or wind damage?

#WeatherBomb https://t.co/3Hl9V29gnl",http://pbs.twimg.com/media/C2bQMCcUcAAChXm.jpg,,2017-01-18 04:20:18,0,5,Twitter for iPhone,186250330,FinnDinneen,Finn Dinneen,2010-09-02 23:35:51,@techlawnz Digital Marketing Wizard | @twonilmedia Creative | @weare80days Co-Founder | GIF Connoisseur | Memes,1268,574,"Wellington, New Zealand",
504,821572893783953409,RT @skcropinsurance: Producers are covered for wildlife damage to unharvested crop. Contact your local #CropInsurance office to discuss htt?,,,2017-01-18 04:20:16,3,0,Twitter for iPhone,722480962068590592,SCICsjaques,Shawn Jaques,2016-04-19 17:44:19,I am the President and CEO of the Saskatchewan Crop Insurance Corporation .  I have been with SCIC for over 23 years.  I also operate a farm in northeast Sask.,142,121,"Melville, Saskatchewan",
505,821572864960765952,"Do these organizers realize how they're putting so many people in danger of getting hurt/killed, property damage, t? https://t.co/mqSWDWZMeG",,,2017-01-18 04:20:09,0,0,Twitter for iPhone,926622782,Politicalfin,Lori,2012-11-05 01:55:27,100% Trump/Pence fan! Making America great & safe again! ??,145,128,Texas!,
506,821572843594924032,@NoahCRothman Tsk. USG damage assessors (Carr/Kirchhofer) testified no resultant injury or death https://t.co/6E2RDwh2z7 @CassandraRules,,,2017-01-18 04:20:04,0,0,TweetDeck,59016368,taheati,taheati,2009-07-22 03:07:46,#Heatlifer c1996. Optimist in denial. Mental floss. ? Dirty Pretty Things http://t.co/mPDIK0E9Ee,395,281,,
507,821572839308427264,RT @TheScamJoanne: when u overreacted &amp; the damage has already been done so u just lay there wondering why anyone puts up with u at all htt?,,,2017-01-18 04:20:03,116,0,Twitter for iPhone,3071703666,abbacirc,abby,2015-03-10 17:36:48,?,171,95,,
508,821572835332091904,"RT @abc7newsbayarea: The roads near #MuirBeach are damaged, and that could cause major problems for citizens and visitors alike: https://t.?",,,2017-01-18 04:20:02,3,0,Twitter for iPhone,61015710,DenisePalmer,Denise Palmer,2009-07-28 20:51:58,"Teacher, love cooking, walking, reading & spending time with friends",514,205,"Oakland, CA",
509,821572832198991873,"RT @bfraser747: ???? #AmericaFirst  

""It is unimaginable how much damage President #BarackObama has done."" ~ @newtgingrich 

#Hannity 
#Ob?",,,2017-01-18 04:20:01,761,0,Twitter Web Client,80793585,niceninja,ccs,2009-10-08 07:40:30,"DAD-Combat Vet (USMC) -Dog Lover -Martial Arts - Constitution - 
I Stand w/our Mil/Vets/LE #SemperFi #AntiCommunist #AntiPoliceState #MoreCowBell",11294,8973,SoCal,
510,821572819985321984,"RT @EWErickson: Damage the DNC with leaks: our democracy is at stake.

Damage national security with leaks: Democrats want you pardoned.",,,2017-01-18 04:19:59,385,0,Twitter for iPhone,3039827263,TJGA00,Tim,2015-02-24 15:10:09,Conservative,25,138,YOW by way of YXE,
511,821572779413741568,When he just got done beating your walls in and you wanna see the damage he did https://t.co/Woh85tw6bf,http://pbs.twimg.com/media/C2bQFWaUAAAykZV.jpg,,2017-01-18 04:19:49,2,2,Twitter for iPhone,762036785648013313,doasplitonit,Jamie,2016-08-06 21:25:02,"elegant as fuck, satans gift to earth",359,330,"cocaine castle, tx ",
512,821572773554233344,RT @thebarakogirl: may damage control bang kailangan? wahaha... akala mo ha... ??? #ALDUBStayInLove,,,2017-01-18 04:19:47,13,0,Twitter for Android,783122570790920192,igrace529,Grace Gustilo,2016-10-04 01:52:25,,132,257,,
513,821572763634827264,"RT @seanmdav: If you hate America and seek to weaken or damage it, you will always find an ally in progressives like Barack Obama.",,,2017-01-18 04:19:45,155,0,Twitter Web Client,74644440,schwingcat,Marie Arf,2009-09-16 03:43:53,"Junior Year Work/Study Intern with Obama's #JobsForJihadis Program
Deplorable. Tainted",4099,3983,,
514,821572754507894784,"I want to be a mom?? I want a family?? (Not yet, of course.) But what if I damage my children for life? What if my family isn't ""real""?",,,2017-01-18 04:19:43,0,0,Twitter for Android,2424735836,scatteredwhims,Emily Colby,2014-04-03 03:34:58,"falling in love with trees every day.

(Christian. queer/bi. writer, dreamer, artist. academia?)",132,199,,
515,821572746152841216,RT @ggreenwald: I visited Chelsea Manning &amp; spent countless hours on phone w/her. Damage is palpable. UN found she was abused. Clemency is?,,,2017-01-18 04:19:41,1516,0,Twitter Web Client,602855254,SamIAm_YoureNot,Sam Richardson,2012-06-08 15:41:23,"I AM AN ACTOR FIRST AND FOREMOST, THAT IS THE FIRST THING YOU SHOULD KNOW ABOUT ME also i do other stuff like piano BUT ACTING IS MY FIRST ROLE IN LIFE OKAY",135,297,,
516,821572662090727424,RT @CutestCIothes: when u overreacted &amp; the damage has already been done so u just lay there wondering why anyone puts up with u at all htt?,,,2017-01-18 04:19:21,224,0,Twitter for iPhone,615257037,Shelbsta14,Shelbs,2012-06-22 13:40:55,abw,200,224,,
517,821572642981429248,"Also, their lasers never damage anything around them when they miss. #ChoppingMall https://t.co/Ag88SLteR6",,,2017-01-18 04:19:16,0,0,Twitter for Android,17222546,LeeRostad,? Lee Rostad,2008-11-06 23:56:52,Rogue. Raconteur. Renaissance Man.                                Guitar/vox in RC Trouble & Big Carroll,107,516,@rctrbl / @bigcarrollmusic,
518,821572638912827393,Trump has bared his fangs to Merkel. He will do untold damage to Europe | Josef Joffe https://t.co/mIVoW7GJ0c ? see? https://t.co/8LcbjPhqBG,,,2017-01-18 04:19:15,1,1,dlvr.it,800799248707031040,TOMORROWNEWS199,American Eagle,2016-11-21 20:33:13,#TRUMP #NEWS #POLITICS,2833,4720,Estados Unidos,
519,821572637855911937,"@TooReal4ThisApp Because most of these numbers an not an accompishment of any kind, and do not reflect the damage O has inflicted.",,,2017-01-18 04:19:15,0,0,Twitter for Android,1235973780,jjmorris123,Gut the DNC,2013-03-02 19:17:15,,42,138,SoCal uber alles,
520,821572629052145664,RT @SaneVaxx: Published study confirms MMR vaccine damage in five year old child. https://t.co/JhHGCJFpfs,,,2017-01-18 04:19:13,4,0,Twitter for iPhone,4435179915,showlady102,consuela,2015-12-10 07:36:12,"Conservative Christian, love my country, love my family, and Jesus. Against big government and against mandatory vaccinations. #gardasilkills #TrumpisMyPres",2410,2821,United States,
521,821572627902906368,"Come throw another fan across the room, that'll fix shit, it's. it like you haven't done enough damage to this place.",,,2017-01-18 04:19:13,0,0,Twitter for iPhone,34706192,DestinCastillo,Polo Warhorse,2009-04-23 19:39:10,Follow my shit. You wont regret it! #teamiphone #teamnativeamexican sc: destin69cas,332,534,,
522,821572626698993666,Damage to roads near Muir Beach could leave city landlocked: More damage to Highway 1 near Muir Beach could leave? https://t.co/Ty9Vni3a6x,,,2017-01-18 04:19:12,0,0,dlvr.it,116012960,pacificanews,Pacifica News,2010-02-20 20:27:14,"Curating the best media feeds in Pacifica. Part of the 400-city The Breaking News Network, the largest community news network supporting the social good",1093,230,Pacifica CA,
523,821572626145574914,?Vertonghen suffers ligament damage? https://t.co/eoV58qAJwX #ItsParto,,,2017-01-18 04:19:12,0,0,IFTTT,2470537603,shoebpopatia7,ShoebPopatia,2014-04-30 08:08:56,,116,140,,
524,821572610869854208,RT @MeloniFulvio: #3: Collateral Damage: Guiding and Protecting Your Child Through the Minefield of Divorce https://t.co/uQ5Twx43KL,,,2017-01-18 04:19:09,5,0,Twitter for Android,412928097,dona__pcla,donna ??,2011-11-15 08:58:20,I'm happy with you :),86,2138,beach,
