,id,text,media_url,video_url,created_at,retweet_count,favorite_count,source,user_id,user_screen_name,user_name,user_created_at,user_description,user_followers_count,user_friends_count,user_location,user_coordinates
435,821889255001780224,Freezing rain has been reported in the Winnemucca area. Drive Safely! #nvwx,,,2017-01-19 01:17:23,1,2,Hootsuite,589304873,NWSElko,NWS Elko,2012-05-24 17:59:24,Official Twitter account for the National Weather Service Elko. Details: http://t.co/DT7PGbdIaq,3922,248,"Elko, NV",
436,821889217575817216,Canyons School Board votes to seek state waiver of two required courses Freezing rain is causing transportation ha? https://t.co/Uq5EEMC9LE,,,2017-01-19 01:17:14,0,0,IFTTT,3270783145,faridabadtutor,Faridabad Tuitions,2015-07-07 06:48:05,"Female Tutor for Tuition for all classes in Faridabad 9-10th Maths,  Abacus Coaching Chawla Colony #Ballabgarh #Faridabad #Haryana Call:9953732265",668,9,"Ballabgarh, Faridabad, Haryana",
437,821888659502796801,"RT @JeremyGlobalTV: Great ride along w/ @Peel_Paramedics @LSaindonPCP! 70+ calls today for patients falling, many slipped on ice during fre?",,,2017-01-19 01:15:01,19,0,Twitter for iPad,92564803,Caledon_Mayor,Allan Thompson,2009-11-25 17:04:06,Mayor of #Caledon since 2014. Proudly serving the Caledon Ward 2 community since 2003. Proud father. Proud farmer.,2614,2721,"Caledon, ON",
438,821888599302045696,"Update: EC Freezing rain warning ended for High Level, Ft. Chipewyan, and surrounding areas. (6:14pm) https://t.co/dQ3qLWnhej #ABRoads",,,2017-01-19 01:14:46,0,0,Hootsuite,621195039,511Alberta,511 Alberta,2012-06-28 16:19:22,"Get up-to-date highway conditions and safety information 24/7. Tweet us, call 511 or download our app to Know Before You Go!",81975,246,"Alberta, Canada",
439,821888478032134144,Because walking in the freezing rain with tears is how I wanted to spend my night even after the other night my car broke. I can't win.,,,2017-01-19 01:14:17,0,0,Twitter for iPhone,606931352,Mallery67,Mallery Calorie?,2012-06-13 05:56:45,Thankful for the life I've been given. @kamaborn 12.27.15 ???,281,191,"Auburn, IN",
440,821888250650497025,Really?  How about now with freezing rain? https://t.co/oKZkRsaL9o,,,2017-01-19 01:13:23,0,0,Twitter for Android,152190901,scaggsbones,3_Scag_Surf_Board,2010-06-05 09:09:09,"Divorced, Father of 4 Boys, and trying hard to be happy and friendly to all people.",29,76,"Boise, Idaho",
441,821888206652047361,@NWSBoise freezing rain at Victory and Eagle road,,,2017-01-19 01:13:13,0,1,Twitter for iPhone,128952632,boisefwxguy,Chuck Redman,2010-04-02 18:27:04,,46,64,,
442,821888032601059328,"Record breaking snow and brutally cold temperatures are not enough. No, says Mother Nature. How about an inch of freezing rain? #pnw #winter",,,2017-01-19 01:12:31,0,1,Twitter for iPhone,1107871652,Susan56860487,boop,2013-01-21 02:38:31,,8,10,,
443,821887439610531844,Weather service: Freezing rain arrival pushed until the afternoon - https://t.co/SUO4eszGbw #service https://t.co/sUIpdnpN18,,,2017-01-19 01:10:10,0,0,DragPlus,2360697702,weather_agent,Weather agent,2014-02-25 07:44:20,weather,606,1873,,
444,821886982842437632,@PoGoServer no but I wouldn't complain in some cases. Walking In the freezing rain in rural areas just ain't happening these days,,,2017-01-19 01:08:21,0,0,Twitter for Android,46305910,aine93,Elana Rabinow-Hughes,2009-06-11 03:41:32,,52,165,,
445,821886852324061184,@Dede_Watson Not too cold! We had freezing rain and fog this week. #JustHaves,,,2017-01-19 01:07:50,0,0,Twitter for iPhone,78431693,Cruiserk,Julie K-H,2009-09-29 22:16:25,"Intermediate & SpecEd teacher, 1:1 classroom, new blogger, lover of contests, wife & busy mom of 3. #lifelonglearner Looking to make global class connections.",1467,2307,SW Ontario,
446,821886743024717825,"@Fffeisty I hear you , we love to eat by the water when we can.  Today's water here was freezing rain, lacks the ambiance of beachfront.",,,2017-01-19 01:07:24,0,0,Twitter for iPad,18912394,Leacyo,Leacy O'Brien,2009-01-12 19:45:39,"Recently retired, previously Director, Advocacy, & Communication @CAMRT, hockey fan, fashionista and best job of all, nana.",224,654,"Ottawa, Ontario",
447,821886630890008578,"@boisestatelive Nice job BSU... Freezing rain and horrible conditions.  But nevermind student safety, they shld be fine, maybe, I hope so!",,,2017-01-19 01:06:57,0,0,Twitter for Android,152190901,scaggsbones,3_Scag_Surf_Board,2010-06-05 09:09:09,"Divorced, Father of 4 Boys, and trying hard to be happy and friendly to all people.",29,76,"Boise, Idaho",
448,821886467186237441,"Freezing rain, ice and fallen trees forced the closure of highways and roads in Oregon and Washington today.? https://t.co/nsVthj5sWz",,,2017-01-19 01:06:18,0,0,IFTTT,734822919168102400,pdxnews_,pdxnews,2016-05-23 19:06:51,an aggregator bot.,306,0,pdx,
449,821886454989103104,"RT @OPB: Freezing rain, ice and fallen trees forced the closure of highways and roads in Oregon and Washington today. https://t.co/Ijcefzq5?",,,2017-01-19 01:06:15,5,0,Twitter for iPhone,721776984469086208,FoodfunMama,Deb Cage??,2016-04-17 19:06:57,"Love family, cooking, baking, sports too. #Broncos #Lucifer ? #BlackList craft beer, wine, reading, & gardening. Nature's Bounty! Cooking Shows! #Grimm",1189,2139,Pacific NW ,
450,821886433572962304,RT @IdahoWxOnline: We are seeing reports (along with radar indications) of snow switching to freezing rain across the Boise area. Roads are?,,,2017-01-19 01:06:10,1,0,TweetDeck,381833291,HollyBeechMP,Holly Beech,2011-09-29 01:04:29,"Meridian Press reporter with Idaho Press-Tribune, covering local city, school, business and community news. NNU grad, studied journalism, history and Spanish.",1523,1017,"Nampa, Idaho",
451,821886409308966913,RT @AlisonKIRO7: Freezing rain and strong wind have I-90 shut down over Snoqualmie Pass. At 5pm why it is still too dangerous for crews to?,,,2017-01-19 01:06:04,11,0,Twitter for iPhone,1700353459,HopintheDark,Bill A. 'Merica,2013-08-25 22:31:45,KCCO/CHIVE ON!,519,2267,"Sisters, OR",
452,821886347233198080,"RT @OPB: Freezing rain, ice and fallen trees forced the closure of highways and roads in Oregon and Washington today. https://t.co/Ijcefzq5?",,,2017-01-19 01:05:49,5,0,Twitter Web Client,7955032,seashellseller,Ann Fontaine ?,2007-08-04 14:34:57,,832,547,,
453,821886303100760064,"School buses, flights cancelled in Ottawa as freezing rain falls... ##Schoolbuscancellations https://t.co/IDhRO1UQ8s",,,2017-01-19 01:05:39,0,0,Google,2653454930,lostkail,Kail,2014-07-17 10:56:31,"I'm Kail, I was given a girls name when I was a baby because my parents are idiots.",17065,21827,Winnipeg,
454,821886141720711168,"Freezing rain, ice and fallen trees forced the closure of highways and roads in Oregon and Washington today.? https://t.co/6SMczYP8fN",,,2017-01-19 01:05:00,5,7,TweetDeck,21512383,OPB,OPB,2009-02-21 20:03:19,"Oregon Public Broadcasting: Giving voice to the community, connecting Oregon and its neighbors, illuminating a wider world.",75516,926,Oregon,
455,821886086674870275,"@IncurableWander I wish we had that weather here, where there is freezing rain #foodtravelchat",,,2017-01-19 01:04:47,0,0,TweetDeck,3360769564,BackpackBritts,Backpacking Britts,2015-07-05 14:57:48,"Britt & Derek hope to inspire you to experience the world. | #TravelBlogger, #Foodie, #Drinks, & #RoadTrip | #FoodTravelChat Wed 8PM EST | #SY5Chat Tue 12PM EST",8249,6591,"Massachusetts, USA",
456,821886025702076416,We are seeing reports (along with radar indications) of snow switching to freezing rain across the Boise area. Road? https://t.co/QCuayeMgSG,,,2017-01-19 01:04:33,1,0,Twitter for iPhone,2704890090,IdahoWxOnline,Idaho Weather Online,2014-08-03 21:05:48,"Covering Idaho's weather #IDwx with updates on winter storms, flooding, droughts and of course our nice weather days too!",120,217,"Boise, ID",
457,821885913391251456,Pouring down freezing rain #DriveSafe #DriveWithCaution,,,2017-01-19 01:04:06,0,0,Twitter for iPhone,377510265,misssamee808,??a??ee,2011-09-21 17:56:42,Born & Raised on the Oldest Hawaiian Island. Blessed To Be A SAHM with a Degree. God Is Good. Thankful. Grateful. Blessed. Luke 1:45,900,370,"Kauai, Hawaii ?? PNW",
458,821885840204976128,@The_Jenius thanks for rubbing it in! HAHA freezing rain in New England today. #foodtravelchat,,,2017-01-19 01:03:48,0,3,TweetDeck,3360769564,BackpackBritts,Backpacking Britts,2015-07-05 14:57:48,"Britt & Derek hope to inspire you to experience the world. | #TravelBlogger, #Foodie, #Drinks, & #RoadTrip | #FoodTravelChat Wed 8PM EST | #SY5Chat Tue 12PM EST",8249,6591,"Massachusetts, USA",
459,821885406841106432,RT @KREMMolly: Here are some expected rain totals over the next 24hrs. Most areas will be above freezing. Low elevation snow pack continues?,,,2017-01-19 01:02:05,1,0,Hootsuite,15756056,KREM2,KREM 2 NEWS,2008-08-06 22:20:53,"Covers the latest news, weather & sports around the Inland Northwest. Based in #Spokane, Wash. Owned by @Tegna. Check out #KREMBTS for a look behind the scenes.",49875,1870,"Spokane, Washington",
460,821885150506139649,Thank Goodness for the rain... Freezing is not my style. #SeattleWeather,,,2017-01-19 01:01:04,0,0,Facebook,460303277,MadcityKat,Kat johnson,2012-01-10 16:21:38,"We help small to medium biz to become Social! In 5 years, will your biz be here? Only if you're social!",79,158,Washington State,
461,821884920893034496,Did I mention freezing rain so the roads are a complete mess,,,2017-01-19 01:00:09,0,0,Twitter for iPhone,758006446705344512,timberbaronness,Skye Terra,2016-07-26 18:29:55,my life is film & history & also film history; known on tumblr as maureenfitzsimons,79,126,,
462,821884916321296385,"Freezing rain, ice and fallen trees force road closures in Oregon and Washington ? The Register-Guard https://t.co/vrFL9Fwp6B",,,2017-01-19 01:00:08,0,0,ordiscovery,3042455856,ORDiscovery,The Oregon Discovery,2015-02-26 05:15:49,"News, Events, Deals, and Jobs in the Beaver State",10908,6056,"Oregon, USA",
463,821884714176970752,"Large area of freezing rain about to hit Northern #Manitoba.
#MBwx #MBstorm
#Thompson #Gillam https://t.co/eXx1Y0WrhH",http://pbs.twimg.com/media/C2fqmmFW8AA18yv.jpg,,2017-01-19 00:59:20,0,0,Twitter Web Client,3229481715,MeteoAntoine,Antoine Petit,2015-05-03 01:29:54,French Canadian meteorologist ?. Runner. Tweets here are my own.,277,78,"Montr?al, Qu?bec",
464,821884546333478912,"@NWSBoston @BarryWBZ This will be a problem tonight and early A.M. Freezing rain in Peabody, spotty black ice Billerica",,,2017-01-19 00:58:40,0,0,Twitter for iPhone,121908176,BostonLand,Boston Landscape Co.,2010-03-11 00:34:44,Boston Area Commercial Landscaping Installation and Maintenance Company- Snow and Ice Management in the winter months.,156,430,"Boston, MA",
465,821884441987452928,"RT @NWSBoise: Officially, 1.5 inches of snow at the #Boise Airport. Precipitation has changed to freezing rain. Roads are very slick! #idwx",,,2017-01-19 00:58:15,16,0,Twitter for iPad,768574541798834176,OasisMountain,Rob Armstrong,2016-08-24 22:23:45,"single, self employed ...spending time outdoors/hiking/gym etc",412,264,"Calgary, Alberta",
466,821884250890735616,"What's worse: idiots who drive too fast when it's snowing, or idiots that drive too fast when there's freezing rain? https://t.co/om9ZpsacPb",http://pbs.twimg.com/tweet_video_thumb/C2frWdNUkAAvj-D.jpg,,2017-01-19 00:57:29,0,0,Twitter for iPhone,289176213,zibbaria,Jamie Merrill,2011-04-28 04:46:48,,56,52,,
467,821884054983348224,There's gonna be snow and freezing rain while I'm sleeping ?... You know what that means... ? https://t.co/Hvsa3UOoeI,http://pbs.twimg.com/tweet_video_thumb/C2frKmPUoAELLKV.jpg,,2017-01-19 00:56:43,0,1,Twitter for iPhone,3654843493,GayGodGoals,LAURA ?,2015-09-23 02:07:44,"Matthew Lush, Bradlee Wannemacher, The Psychic Twins, Chris Oflyng, Nick Laws, & Maddie Welborn follows! ? What I really want in life is to meet Matthew ???",604,96,I wish it's Matthew's arms ??,
468,821883968924499968,RT @BrentKBOI: Just in the last few minutes... snow has turned to freezing rain in downtown Boise. https://t.co/6w1YdlNHmu,,,2017-01-19 00:56:22,2,0,TweetDeck,18923480,KBOITV,KBOI 2News,2009-01-13 01:24:30,"Breaking news, weather and sports for Boise and all of the Treasure Valley.",21766,1847,"Boise, ID",
469,821883950930898944,RT @RolandKBOI: Starting to see freezing rain in parts of the valley. Heavy snow falling in the mountains. #idwx https://t.co/vBJKMB8mhA,http://pbs.twimg.com/media/C2fiaH9WIAAO3kD.jpg,,2017-01-19 00:56:18,2,0,TweetDeck,18923480,KBOITV,KBOI 2News,2009-01-13 01:24:30,"Breaking news, weather and sports for Boise and all of the Treasure Valley.",21766,1847,"Boise, ID",
470,821883923135242240,"School buses, flights cancelled in Ottawa as freezing rain falls... #Schoolbuscancellations https://t.co/WEknesLxYm",,,2017-01-19 00:56:11,0,0,dlvr.it,2781294222,mar1orie,MARJORIE,2014-08-31 00:20:04,I'll never try to fit in. I was born to STAND OUT. *hahah*,20494,23790, Pennsylvania,
471,821883736287367168,"RT @NWSBoise: Officially, 1.5 inches of snow at the #Boise Airport. Precipitation has changed to freezing rain. Roads are very slick! #idwx",,,2017-01-19 00:55:27,16,0,Twitter for iPad,2370694418,Cam_Ann_San,Camas Sanchez,2014-03-03 17:06:42,Positive Mind-Positive Vibes-Positive Life-! #RAIDERNATION #DUBNATION #BSU #APBT #UFC,1064,1813,"Boise, Idaho",
472,821883627353079810,ChameleonDrizzle Disguised asSnow but its actually freezing rain @HeidiStea @daisytobey @blondleon @CVDmtl? https://t.co/hDph0o4DcO,,,2017-01-19 00:55:01,0,3,Twitter Web Client,779336031871070208,ejock_emmanuel,EMMANUELS MONTREAL,2016-09-23 15:06:04,"Freelance Photographer & Blogger proudly promoting my city of MONTREAL and all its ART , MUSIC and Attractions to the World",85,130,"Montr?al, Qu?bec",
473,821882910055596033,"RT @meghandilesxo: I can handle the rain, but I can't handle the rain, wind, and freezing cold all put together",,,2017-01-19 00:52:10,28,0,Twitter for iPhone,2451842485,kylaaprince,kyla,2014-04-18 19:18:33,hhs'19,378,238,bay area,
474,821882894805176320,I-90 is shut down over Snoqualmie Pass after freezing rain knocked down trees. 5pm kiro snoqualmiepass @AlisonKIRO7 https://t.co/IIKsbBreYK,,,2017-01-19 00:52:06,0,0,dlvr.it,74998364,SeattleCP,Seattle CP,2009-09-17 12:22:26,Seattle City And Press,2103,11,"Seattle, WA","{'type': 'Point', 'coordinates': [-122.33247834, 47.6054773]}"
475,821882752651948032,@smallhistory absolutely - that's what it's still referred to in Cape Breton.  It's the freezing rain on trees,,,2017-01-19 00:51:32,0,2,Twitter for iPhone,34614813,uncommongroup,Gordon Stevens,2009-04-23 13:44:51,Family - Business - Community. @uncommonhfx @rumrunnersns @sugahhfx @lostcod,4606,1862,halifax,
476,821882709974728704,RT @AlisonKIRO7: Freezing rain and strong wind have I-90 shut down over Snoqualmie Pass. At 5pm why it is still too dangerous for crews to?,,,2017-01-19 00:51:22,11,0,TweetDeck,4719668475,StrommeKIRO7,Lisa Stromme,2016-01-06 00:33:54,"Executive Producer, KIRO 7",184,302,"Seattle, WA",
477,821882307560632320,"RT @NWSBoise: Officially, 1.5 inches of snow at the #Boise Airport. Precipitation has changed to freezing rain. Roads are very slick! #idwx",,,2017-01-19 00:49:46,16,0,Twitter for iPhone,102447288,BoiseDailyPhoto,Debbie Courson Smith,2010-01-06 18:47:26,This is my salute to the City of Trees. Garden fairy. Pinballer. Social media/content mgr.,1936,1194,"Boise, ID",
478,821882266485821440,RT @AlisonKIRO7: I-90 is shut down over Snoqualmie Pass after freezing rain knocked down trees. 5pm #kiro #snoqualmiepass https://t.co/SIeI?,,,2017-01-19 00:49:36,4,0,Twitter for iPhone,278175290,fukuphil,Phil Ackerman,2011-04-06 19:19:09,,28,285,,
479,821882263960813568,"@_levinator_ my family &amp; I hiked 5 miles in pouring rain in the freezing Alaskan wilderness, where we encountered a black bear",,,2017-01-19 00:49:36,0,0,Twitter for Android,43728616,TarynDeOilers,Her?,2009-05-31 18:20:24,This is my twitter page found on the worldwide web,184,133,California,
480,821881966131838976,RT @48jimjohnson: Morning gang Moanday #2 coming at ya fierce! Freezing rain so do take care!! ? Have a day ? https://t.co/dajvXJoexq,http://pbs.twimg.com/media/C2XbsByXUAAlQwt.jpg,,2017-01-19 00:48:25,2,0,Twitter for Android,2751033477,mercyraintree,Elizabeth Carmen ?,2014-08-25 17:20:13,21+ only,4124,3239,Earth,
481,821881843964219393,RT @ShannonODKOMO: Cold air still trapped in the @wsdot_passes with warm rain riding over those frozen surfaces = freezing rain &amp; dicey dri?,,,2017-01-19 00:47:56,3,0,TweetDeck,16086928,komonews,KOMO News,2008-09-01 19:48:55,"The latest breaking news, traffic, and weather from Seattle and Western Washington.",264293,2138,"Seattle, WA",
482,821881727593357312,I FINALLY HAVE WIFI AGAIN WE HAD FROM FREEZING RAIN THAT KNOCKED IT OUT FOR A FEW DAYS BUT ITS BACK AGAIN AND IM EXCITED,,,2017-01-19 00:47:28,0,0,Twitter for iPhone,298726968,FaitthChristine,Faith,2011-05-14 20:39:11,I wrote a paper on Nirvana once.,384,1191,In this moment,
483,821881726532222976,RT @48jimjohnson: Morning gang Moanday #2 coming at ya fierce! Freezing rain so do take care!! ? Have a day ? https://t.co/dajvXJoexq,http://pbs.twimg.com/media/C2XbsByXUAAlQwt.jpg,,2017-01-19 00:47:28,2,0,Twitter Web Client,51594407,pauline_mcd,pauline,2009-06-27 23:49:51,"Dogs are my favourite people. if I've said something to offend you, tell me. I may want to use it again https://t.co/4gzLSimicN",11060,8650,"Ontario, CA",
484,821881072887566336,RT @AlisonKIRO7: Freezing rain and strong wind have I-90 shut down over Snoqualmie Pass. At 5pm why it is still too dangerous for crews to?,,,2017-01-19 00:44:52,11,0,Twitter for iPhone,20422072,Frisbeetarian,Frisbeetarian,2009-02-09 07:43:31,,262,434,The Other Washington,
485,821881018059632641,"RT @NWSBoise: Officially, 1.5 inches of snow at the #Boise Airport. Precipitation has changed to freezing rain. Roads are very slick! #idwx",,,2017-01-19 00:44:39,16,0,Twitter for iPhone,377420439,KarenLehr,Karen Lehr,2011-09-21 15:07:31,Reporter/Anchor at KIVI @IdahoOnYourSide. Animal lover. Chocoholic. Florida native. @UCF Alum.,1378,590,"Boise, ID",
486,821880542001889280,"RT @NWSBoise: Officially, 1.5 inches of snow at the #Boise Airport. Precipitation has changed to freezing rain. Roads are very slick! #idwx",,,2017-01-19 00:42:45,16,0,Twitter for iPhone,455527953,AndreaLane9,Andrea Lane,2012-01-05 06:29:30,,15,54,,
487,821880532413751296,RT @AlisonKIRO7: I-90 is shut down over Snoqualmie Pass after freezing rain knocked down trees. 5pm #kiro #snoqualmiepass https://t.co/SIeI?,,,2017-01-19 00:42:43,4,0,Twitter Web Client,27975969,ProfShulman,Professor Shulman,2009-03-31 22:06:55,"Host of Seattle Growth Podcast,  
Associate Professor of Marketing at the University of Washington",220,171,Seattle,
488,821880163130454017,"RT @NWSBoise: Officially, 1.5 inches of snow at the #Boise Airport. Precipitation has changed to freezing rain. Roads are very slick! #idwx",,,2017-01-19 00:41:15,16,0,TweetDeck,1050809894,ESPNBoise,ESPN Boise,2012-12-31 17:31:31,"Boise's home for ESPN. 96.5FM, 730AM or download the ESPN Boise app! Home of The Press Box W/ BJ & Jay from 9-11am, and The Drive W/ Joey & Gold from 2-6pm.",5132,2218,"Boise, Idaho",
489,821880113700728834,"Officially, 1.5 inches of snow at the #Boise Airport. Precipitation has changed to freezing rain. Roads are very slick! #idwx",,,2017-01-19 00:41:03,16,17,TweetDeck,879162199,NWSBoise,NWS Boise,2012-10-14 02:33:51,Official Twitter account for the National Weather Service Boise. Details: http://t.co/KKTK7cZlhK,8793,674,"Boise, Idaho",
490,821880076983799808,RT @AlisonKIRO7: Freezing rain and strong wind have I-90 shut down over Snoqualmie Pass. At 5pm why it is still too dangerous for crews to?,,,2017-01-19 00:40:54,11,0,MySeattleNews,816313821883146240,MySeattleNews,My Seattle News,2017-01-03 16:02:36,Seattle Area News Coverage: @KING5Seattle @KOMONEWS @NWCN @KIRO7Seattle @Q13Fox,20,0,"Seattle, WA",
491,821880043580198912,RT @OcciferFe__ows: Freezing Rain coming in tomorrow... remember quick motions and agressive breaking is the only way to handle ice. ??,,,2017-01-19 00:40:46,2,0,Twitter for Android,2592460189,DParkerfinn,El Scorcho,2014-06-28 04:15:01,mv/cc 18,168,171,"Camas, WA",
492,821879908246966272,"Freezing rain, ice and fallen trees force road closures in Oregon and Washington ? The Register-Guard https://t.co/1I6S2v4tut",,,2017-01-19 00:40:14,0,0,ordiscovery,3042455856,ORDiscovery,The Oregon Discovery,2015-02-26 05:15:49,"News, Events, Deals, and Jobs in the Beaver State",10908,6056,"Oregon, USA",
493,821879905348558848,RT @AlisonKIRO7: I-90 is shut down over Snoqualmie Pass after freezing rain knocked down trees. 5pm #kiro #snoqualmiepass https://t.co/SIeI?,,,2017-01-19 00:40:13,4,0,TweetDeck,21116401,KIRO7Seattle,KIRO 7,2009-02-17 18:49:24,"News, traffic, weather & more from Seattle and Western WA. More KIRO 7 tweets: http://t.co/Igw3lNkQ (Note: Tweets to us may be showcased in any of our media.)",285087,10096,Seattle,
494,821879646618722305,RT @AlisonKIRO7: Freezing rain and strong wind have I-90 shut down over Snoqualmie Pass. At 5pm why it is still too dangerous for crews to?,,,2017-01-19 00:39:12,11,0,Twitter for iPad,2416940856,graydaygamer,FreeEmbassyCat,2014-03-29 04:46:10,"Gamer, progressive, photography buff. On a quest to make the world better, by sharing important info from everywhere. #NeverHillary",2814,438,"Redmond, Wa",
495,821879606730956801,"So when it's been freezing rain all night and you wake up to this, you know it's a work from? https://t.co/SBf8f5GMa5",,,2017-01-19 00:39:02,0,0,Instagram,3687989716,simplyabout,simplyaboutme,2015-09-17 17:36:07,"Sharing life experiences, reviewing various things from beauty, fashion, movies, and electronics to name a few. Artistic with more hobbies than time!",27,106,,
496,821879484672577538,RT @AlisonKIRO7: Freezing rain and strong wind have I-90 shut down over Snoqualmie Pass. At 5pm why it is still too dangerous for crews to?,,,2017-01-19 00:38:33,11,0,Twitter Web Client,242619951,ad198741,Arnold Dillon,2011-01-25 05:47:06,"Ex-Montrealer and into politics, entertainment and fashion etc.",533,5002,Toronto,
497,821879483040985092,I-90 is shut down over Snoqualmie Pass after freezing rain knocked down trees. 5pm #kiro #snoqualmiepass https://t.co/SIeIq3tX43,http://pbs.twimg.com/media/C2fnCGiXcAADMc3.jpg,,2017-01-19 00:38:33,4,6,IFTTT,146250468,AlisonKIRO7,Alison Grande,2010-05-21 00:04:58,l am a news reporter for KIRO-TV. Always looking for story ideas. What's happening out there? Let me know!,5889,860,Seattle,
498,821879480092336128,"Bus service for GTA school boards cancelled, flights delayed due to freezing rain - T? https://t.co/iAt4khuyUQ ?? https://t.co/hTQxwg8Eos",,,2017-01-19 00:38:32,1,0,cbc_diff,819168808262922241,cbc_diff,cbc_diff,2017-01-11 13:07:18,Tweeting edits to the CBC. Avatar by Leah Vandenberg https://t.co/WtEaTOQERs,16,0,"Toronto, Ontario",
499,821879282297409536,"So when it's been freezing rain all night and you wake up to this, you know it's a work from? https://t.co/g3Kgjvg3TB",,,2017-01-19 00:37:45,0,0,Instagram,3687989716,simplyabout,simplyaboutme,2015-09-17 17:36:07,"Sharing life experiences, reviewing various things from beauty, fashion, movies, and electronics to name a few. Artistic with more hobbies than time!",27,106,,
500,821879255286108162,"Alison Grande @AlisonKIRO7
1m
Freezing rain and strong wind have I-90 shut down over Snoqualmie Pass. At 5pm why... https://t.co/1Lcxr7R83O",,,2017-01-19 00:37:38,0,0,Facebook,560894199,Ialerts1,Ialerts1,2012-04-23 03:58:19,"IAlerts1 is a Incident Notification Company sending Police,Fire,Breading News,Weather,Trauma and more.",1162,2098,"Marlborough,MA",
501,821879239750262785,RT @YRBNorthPeace: #YXJ Chance of freezing rain overnight. Possible slippery roads on morning commute tomorrow. Please #SlowDown drive 2 co?,,,2017-01-19 00:37:35,3,0,Twitter for iPad,820764966919622656,PeaceRiverNorth,@BCPeaceRiverNorth,2017-01-15 22:49:51,"@ElectRobFraser for BC Peace River North MLA. Our strongest industry and community advocate. May 8, 2017 - Vote Rob Fraser",49,225,"British Columbia, Canada",
502,821879121735204865,Anyone still use this phrase? It was unfamiliar to me. I think the  contemporary version is freezing rain + swearin? https://t.co/NJ6EuAK0X4,,,2017-01-19 00:37:07,1,3,Twitter Web Client,2458795916,smallhistory,Small History NS,2014-04-22 22:46:58,"Real daily news c.1880?1910 from rural & small-town Nova Scotia, as it was reported by local newspapers",1713,475,Nova Scotia,
503,821878967577636864,RT @AlisonKIRO7: Freezing rain and strong wind have I-90 shut down over Snoqualmie Pass. At 5pm why it is still too dangerous for crews to?,,,2017-01-19 00:36:30,11,0,TweetDeck,21116401,KIRO7Seattle,KIRO 7,2009-02-17 18:49:24,"News, traffic, weather & more from Seattle and Western WA. More KIRO 7 tweets: http://t.co/Igw3lNkQ (Note: Tweets to us may be showcased in any of our media.)",285087,10096,Seattle,
504,821878795753832448,RT @AlisonKIRO7: Freezing rain and strong wind have I-90 shut down over Snoqualmie Pass. At 5pm why it is still too dangerous for crews to?,,,2017-01-19 00:35:49,11,0,Twitter Web Client,65411847,ClaireKOIN,Claire Anderson,2009-08-13 17:09:23,@KOIN 6 CBS Meteorologist/Traffic/Reporter,2572,2394,"Portland, OR",
505,821878702438916096,Freezing rain and strong wind have I-90 shut down over Snoqualmie Pass. At 5pm why it is still too dangerous for cr? https://t.co/zvilCogVye,,,2017-01-19 00:35:27,11,15,Twitter for iPhone,146250468,AlisonKIRO7,Alison Grande,2010-05-21 00:04:58,l am a news reporter for KIRO-TV. Always looking for story ideas. What's happening out there? Let me know!,5889,860,Seattle,
